Grambank ID	Feature	Possible Values	Value	Source	Comment	Detailed comment	Example
TS082	Do numerals have the same form in attributive and predicative use?	1: present, 0: absent	?	"Tsintsius (1982:3-308); Tsintsius (1997:188-201)"			
TS083	Is the meaning ‘to hunt’ expressed as noun+denominalizer?	1: present, 0: absent	?	"Tsintsius (1982:3-308); Tsintsius (1997:188-201)"			
TS083	Are instrumental and comitative expressed by the same marker?	1: present, 0: absent	?	"Tsintsius (1982:3-308); Tsintsius (1997:188-201)"			
TS084	Are the meanings ‘to see’ and ‘to try’ expressed by formally identical verbs?	1: present, 0: absent	?	"Tsintsius (1982:3-308); Tsintsius (1997:188-201)"			
TS085	What is the order of personal possessive suffixes and case suffixes?	"0: one category missing; 1: POSS-case; 2: case-POSS; 3: both"	?	"Tsintsius (1982:3-308); Tsintsius (1997:188-201)"			
TS086	Is the pragmatically unmarked order of SV in intransitive clauses?	1: present, 0: absent	1	Tsintsius (1997:200-201)			
TS087	Is the pragmatically unmarked order of VS in intransitive clauses?	1: present, 0: absent	0	Tsintsius (1997:200-201)			
TS088	Is there an aspiration distinction in stops?	1: present, 0: absent	0	"Tsintsius (1982:13); Tsintsius (1997:190)"			