Grambank ID	Feature	Possible Values	Value	Source	Comment	Detailed comment	Example
GB020	Are there definite or specific articles?	1: present, 0: absent	0	Kornfilt (1997:106, 273)			
GB021	Do indefinite nominals commonly have indefinite articles?	1: present, 0: absent	0	Kornfilt (1997:106, 275)	not commonly		
GB022	Are there prenominal articles?	1: present, 0: absent	1	Kornfilt (1997:106, 273)			
GB023	Are there postnominal articles?	1: present, 0: absent	0	Kornfilt (1997:106)			
GB024	What is the order of numeral and noun in the NP?	"multistate 1: Num-N; 2: N-Num; 3: both."	1	Kornfilt (1997:106, 429)			
GB025	What is the order of adnominal demonstrative and noun?	"multistate 1: Dem-N; 2: N-Dem; 3: both."	1	Kornfilt (1997:311-315)			
GB026	Can adnominal property words occur discontinuously?	1: present, 0: absent	1	Fanselow (p.c. 2017)			"kitep-ti        Peter   köp      okudu.
book-ACC  Peter   many  read.
kitep-ten          Peter   köp-tü      okudu.
book.SG-ABL Peter   many-ABL  read.
‘Peter reads many books.’"
GB027	Are nominal conjunction and comitative expressed by different elements?	1: present, 0: absent	0	Kornfilt (1997:113-117)			"-yle ‘and’, ‘with’, different syntactic properties:
Hasan-la Ali ‘Hasan and Ali’
Hasan Ali-yle ‘Hasan with Ali’"
GB028	Is there an inclusive/exclusive distinction?	1: present, 0: absent	0	Kornfilt (1997:186)	Only in restricted contexts in predicative possession.		
GB030	Is there a gender distinction in independent 3rd person pronouns?	1: present, 0: absent	0	Kornfilt (1997:281, 291)			
GB031	Is there a dual or unit augmented form (in addition to plural or augmented) for all person categories in the pronoun system?	1: present, 0: absent	0	Kornfilt (1997:281)			
GB035	Are there three or more distance contrasts in demonstratives?	1: present, 0: absent	1	Kornfilt (1997:106, 290)			"bu ‘this’
šu ‘that’
o ‘that over there’"
GB036	Do demonstratives show an elevation distinction?	1: present, 0: absent	0	Kornfilt (1997:106)			
GB037	Do demonstratives show a visible-nonvisible distinction?	1: present, 0: absent	0	Kornfilt (1997:106)			
GB038	Are there demonstrative classifiers?	1: present, 0: absent	0	Kornfilt (1997:1-553)			
GB039	Is there nonphonological allomorphy of noun number markers?	1: present, 0: absent	0	Kornfilt (1997:265-269)		only suffix -lar and its allomorphs	
GB041	Are there several nouns (more than three) which are suppletive for number?	1: present, 0: absent	0	Kornfilt (1997:265-269)			
GB042	Is there productive overt morphological singular marking on nouns?	1: present, 0: absent	0	Kornfilt (1997:265-266)			
GB043	Is there productive morphological dual marking on nouns?	1: present, 0: absent	0	Kornfilt (1997:265-266)			
GB044	Is there productive morphological plural marking on nouns?	1: present, 0: absent	1	Kornfilt (1997:265-266)		-lar	"ǰočuk-lar
[child-PL]
‘children'"
GB046	Is there an associative plural marker for nouns?	1: present, 0: absent	1	Lewis (2001:26)			"mehmet-ler
[Mehmet-PL]
‘Mehmet and his family’"
GB047	Is there a productive morphological pattern for deriving an action/state noun from a verb?	1: present, 0: absent	1	Kornfilt (1997:448)			
GB048	Is there a productive morphological pattern for deriving an agent noun from a verb?	1: present, 0: absent	1	Kornfilt (1997:447)		"-(y)iǰi/-uǰu etc.
-man/-men"	"koš-uǰu
[run-NMLZ]
‘runner’"
GB049	Is there a productive morphological pattern for deriving an object noun from a verb?	1: present, 0: absent	1	Kornfilt (1997:449)	result of action		
GB051	Is there a noun class/gender system where sex is a factor in class assignment?	1: present, 0: absent	0	Kornfilt (1997:270)			
GB052	Is there a noun class/gender system where shape is a factor in class assignment?	1: present, 0: absent	0	Kornfilt (1997:270)			
GB053	Is there a noun class/gender system where animacy is a factor in class assignment?	1: present, 0: absent	0	Kornfilt (1997:270)			
GB054	Is there a noun class/gender system where plant status is a factor in class assignment?	1: present, 0: absent	0	Kornfilt (1997:270)			
GB057	Are there numeral classifiers?	1: present, 0: absent	0	Kornfilt (1997:430)			
GB058	Are there possessive classifiers?	1: present, 0: absent	0	Kornfilt (1997:1-553)			
GB059	Is the adnominal possessive construction different for alienable and inalienable nouns?	1: present, 0: absent	0	Kornfilt (1997:185-186)			"hasan-ïn diš-in
[Hasan-GEN tooth-3SG]
‘Hasan’s tooth’
hasan-ïn ev-in
[Hasan-GEN house-3SG]
‘Hasan’s house’"
GB065	What is the pragmatically unmarked order of adnominal possessor noun and possessed noun?	"multistate 1:Possessor-Possessed; 2:Possessed-Possessor; 3: both"	1	Kornfilt (1997:185)			"hasan-ïn kitab-ïn
Hasan-GEN book-3SG
‘Hasan’s book’"
GB068	Do core adjectives (defined semantically as property concepts such as value, shape, age, dimension) act like verbs in predicative position?	1: present, 0: absent	0	Kornfilt (1997:83)	If the copula is omitted (due to phonological reduction), the past tense marker can be attached directly to the adjective.		"termiz-di-m
[clean-PST-1SG]
‘I was clean.’"
GB069	"Do core adjectives (defined semantically as property concepts; value, shape, age, dimension) used attributively require the same morphological treatment as verbs?"	1: present, 0: absent	0	Kornfilt (1997:414)			
GB070	Are there morphological cases for non-pronominal core arguments (i.e. S/A/P)?	1: present, 0: absent	1	Kornfilt (1997:217-220)			
GB071	Are there morphological cases for pronominal core arguments (i.e. S/A/P)?	1: present, 0: absent	1	Kornfilt (1997:217-219, 281)			"sen biz-e yarïn seyahat-e čïk-acaɣ-iz diye söz ver-di-n
[2SG 1PL-DAT tomorrow trip-DAT go-FUT-1PL saying promise give-PST-2SG]
‘You promised us: we are going on a trip tomorrow.’"
GB072	Are there morphological cases for oblique non-pronominal NPs (i.e. not S/A/P)?	1: present, 0: absent	1	Kornfilt (1997:220-221)			
GB073	Are there morphological cases for oblique independent personal pronouns (i.e. not S/A/P)?	1: present, 0: absent	1	Kornfilt (1997:220-221, 281)			"hasan ban-a yardïm et-ti
[Hasan 1SG-DAT help do-PST]
‘Hasan helped me.’"
GB074	Are there prepositions?	1: present, 0: absent	0	Kornfilt (1997:210)			
GB075	Are there postpositions?	1: present, 0: absent	1	Kornfilt (1997:210)			
GB079	Do verbs have prefixes/proclitics, other than those that ONLY mark A, S or O (do include portmanteau: A & S + TAM)?	1: present, 0: absent	0	Kornfilt (1997:1-553)			
GB080	Do verbs have suffixes/enclitics, other than those that ONLY mark A, S or O (do include portmanteau: A & S + TAM)?	1: present, 0: absent	1	Kornfilt (1997:323-379)			
GB081	Is there productive infixation in verbs?	1: present, 0: absent	0	Kornfilt (1997:1-553)			
GB082	Is there overt morphological marking of present tense on verbs?	1: present, 0: absent	1	Kornfilt (1997:336)			
GB083	Is there overt morphological marking on the verb dedicated to past tense?	1: present, 0: absent	1	Kornfilt (1997:338)			
GB084	Is there overt morphological marking on the verb dedicated to future tense?	1: present, 0: absent	1	Kornfilt (1997:340)			
GB086	Is a morphological distinction between perfective and imperfective aspect available on verbs?	1: present, 0: absent	1	Kornfilt (1997:357-358)	There is a marker of the progressive aspect.	-iyor.	
GB089	Can the S argument be indexed by a suffix/enclitic on the verb in the simple main clause?	1: present, 0: absent	1	Kornfilt (1997:382-384)			
GB090	Can the S argument be indexed by a prefix/proclitic on the verb in the simple main clause?	1: present, 0: absent	0	Kornfilt (1997:382-384)			
GB091	Can the A argument be indexed by a suffix/enclitic on the verb in the simple main clause?	1: present, 0: absent	1	Kornfilt (1997:382)			
GB092	Can the A argument be indexed by a prefix/proclitic on the verb in the simple main clause?	1: present, 0: absent	0	Kornfilt (1997:1-553)			
GB093	Can the P argument be indexed by a suffix/enclitic on the verb in the simple main clause?	1: present, 0: absent	0	Kornfilt (1997:1-553)			
GB094	Can the P argument be indexed by a prefix/proclitic on the verb in the simple main clause?	1: present, 0: absent	0	Kornfilt (1997:1-553)			
GB095	Are variations in marking strategies of core participants based on TAM distinctions?	1: present, 0: absent	0	Kornfilt (1997:390-391)			
GB096	Are variations in marking strategies of core participants based on verb classes?	1: present, 0: absent	0	Kornfilt (1997:390-391)			
GB098	Are variations in marking strategies of core participants based on person distinctions?	1: present, 0: absent	0	Kornfilt (1997:390-391)			
GB099	Can verb stems alter according to the person of a core participant?	1: present, 0: absent	0	Kornfilt (1997:336-382)			
GB103	Is there a benefactive applicative marker on the verb (including indexing)?	1: present, 0: absent	0	Kornfilt (1997:1-553)			
GB104	Is there an instrumental applicative marker on the verb (including indexing)?	1: present, 0: absent	0	Kornfilt (1997:1-553)			
GB105	Can the recipient in a ditransitive construction be marked like the monotransitive patient?	1: present, 0: absent	0	Kornfilt (1997:219-220)			
GB107	Can standard negation be marked by an affix, clitic or modification of the verb?	1: present, 0: absent	1	Kornfilt (1997:123)			"Hasan kitab-ï oku-ma-dï
[Hasan book-ACC read-NEG-PST]
‘Hasan didn’t read the book.’"
GB108	Is there directional or locative morphological marking on verbs?	1: present, 0: absent	0	Kornfilt (1997:1-553)			
GB109	Is there verb suppletion for participant number?	1: present, 0: absent	0	Kornfilt (1997:382)			
GB110	Is there verb suppletion for tense or aspect?	1: present, 0: absent	0	Kornfilt (1997:1-553)			
GB111	Are there conjugation classes?	1: present, 0: absent	0	Kornfilt (1997:336-382)			
GB113	Are there verbal affixes or clitics that turn intransitive verbs into transitive ones?	1: present, 0: absent	1	Kornfilt (1997:331)			
GB114	Is there a phonologically bound reflexive marker on the verb?	1: present, 0: absent	1	Kornfilt (1997:139, 304)			
GB115	Is there a phonologically bound reciprocal marker on the verb?	1: present, 0: absent	1	Kornfilt (1997:159, 306)			
GB116	Do verbs classify the shape, size or consistency of absolutive arguments by means of incorporated nouns, verbal affixes or suppletive verb stems?	1: present, 0: absent	0	Kornfilt (1997:1-553)			
GB117	Is there a copula for predicate nominals?	1: present, 0: absent	1	Kornfilt (1997:78-82)			
GB118	Are there serial verb constructions?	1: present, 0: absent	1	Kornfilt (1997:478)	"“There are verbal sequences with certain aspectual ""light"" verbs that yield verbal compounds, but which are restricted to occurring with the same tense / aspect suffixes on both parts of the compound”"		"söyle-n-ir dur-ur
[tell-REFL-AOR stay-AOR]
‘She keeps on grumbling.’
söyle-n-di dur-du
[tell-REFL-PST stay-PST]
‘She keeps on grumbling.’"
GB119	"Can mood be marked by an inflecting word (""auxiliary verb"")?"	1: present, 0: absent	1	Kornfilt (1997:364-365)		ol	
GB120	"Can aspect be marked by an inflecting word (""auxiliary verb"")?"	1: present, 0: absent	1	Kornfilt (1997:349-350)	not obligatory	“A different form is used for the perfect in the past and future tenses. This is the suffix otherwise used for the reported / inferential past tense: -miš. Where this suffix is attached to a verb and is followed by a past tense suffix or by the auxiliary ol in the future tense, -miš functions as a participle marker and usually expresses perfect aspect.”	"ben lokanta-ya var-diɣ-їm-da hasan yemeɣ -in-i bitir-miš ol-acak
[1SG restaurant-DAT arrive-NMLZ-1SG-LOC Hasan meal-3SG-ACC finish-PST.PTCP be-FUT]
‘When I arrive at the restaurant, Hasan will have finished his meal.’"
GB121	"Can tense be marked by an inflecting word (""auxiliary verb"")?"	1: present, 0: absent	1	Kornfilt (1997:342)		ol	"saat beš-te londra-ya var-miš ol-acaɣ-їm
[o’clock five-LOC London-DAT arrive-PST.PTCP be-FUT-1SG]
‘I will have arrived in London at five o’clock’."
GB122	Is verb compounding a regular process?	1: present, 0: absent	0	Kornfilt (1997:477-478)	"“There are verbal sequences with certain aspectual ""light"" verbs that yield verbal compounds, but which are restricted to occurring with the same tense / aspect suffixes on both parts of the compound”"		
GB123	Are there verb-adjunct (aka light-verb) constructions?	1: present, 0: absent	1	Kornfilt (1997:4, 477-478, 24, 35, 45, 67, 139, 219, 245-246)		yap ‘do’, et ‘make’, at ‘throw'	göz at [eye throw] ‘have a look’
GB124	Is incorporation of nouns into verbs a productive intransitivizing process?	1: present, 0: absent	0	Kornfilt (1997:1-553)			
GB126	Is there an existential verb?	1: present, 0: absent	1	Kornfilt (1997:185-186, 189, 230)			
GB127	Are different posture verbs used obligatorily depending on an inanimate locatum's shape or position (e.g. 'to lie' vs. 'to stand')?	1: present, 0: absent	0	Kornfilt (1997:242-248)			"kitap masa-da
[book table-LOC]
‘The book is on the table.’"
GB129	Is there a notably small number, i.e. about 100 or less, of verb roots in the language?	1: present, 0: absent	0	Kornfilt (1997:1-553)			
GB130	What is the pragmatically unmarked order of S and V in intransitive clauses?	"multistate 1: SV; 2: VS; 3: both"	1	Kornfilt (1997:46, 82)			
GB131	Is a pragmatically unmarked constituent order verb-initial for transitive clauses?	1: present, 0: absent	0	Kornfilt (1997:91)			
GB132	Is a pragmatically unmarked constituent order verb-medial for transitive clauses?	1: present, 0: absent	0	Kornfilt (1997:91)			
GB133	Is a pragmatically unmarked constituent order verb-final for transitive clauses?	1: present, 0: absent	1	Kornfilt (1997:91)			"ben kitab-ï oku-du-m
[1SG book-ACC read-PST-1SG]
'I read the book.’"
GB134	Is the order of constituents the same in main and subordinate clauses?	1: present, 0: absent	1	Kornfilt (1997:46, 91)			
GB135	Do clausal objects usually occur in the same position as nominal objects?	1: present, 0: absent	1	Kornfilt (1997:46-47, 91)	“Within the main clause, nominalized subordinate clauses occupy the position of a corresponding simple noun phrase and therefore will, within an unmarked word order pattern, always precede the main clause verb, since the basic word order is always verb final […] [T]here is also another subordination pattern of very limited use in the modern standard language, borrowed from Persian. This pattern is marked by having a finite subordinate clause, introduced by the complementizer ki, follow the verb of the main clause”		"ben kitab-ï oku-du-m
[1SG book-ACC read-PST-1SG]
'I read the book.’
herkes sen sinema-ya git-ti-n san-їyor
[everybody 2SG cinema-DAT go-PST-2SG believe-PRS.PROG]
‘Everybody believes that you went to the movies.’
isti-yor-um ki yarїn ben-im-le sinema-ya gel-esin
[want-PRS.PROG-1SG COMP tomorrow 1SG-GEN-with cinema-DAT come-2SG.OPT]
‘I want you to come to the movies with me tomorrow.’"
GB136	Is the order of core argument (i.e. S/A/P) constituents fixed?	1: present, 0: absent	1	Kornfilt (1997:82, 91, 215)		if DO is unmarked	
GB137	Can standard negation be marked clause-finally?	1: present, 0: absent	1	Kornfilt (1997:123-125)			"Hasan kitab-ï oku-ma-dï
[Hasan book-ACC read-NEG-PST]
‘Hasan didn’t read the book.’"
GB138	Can standard negation be marked clause-initially?	1: present, 0: absent	0	Kornfilt (1997:123-125)			
GB139	Is there a difference between imperative (prohibitive) and declarative negation constructions?	1: present, 0: absent	0	Kornfilt (1997:43, 123-124)		"declarative: -ma and allomorphs
prohibitive: -ma and allomorphs"	"Hasan kitab-ï oku-ma-dï
[Hasan book-ACC read-NEG-PST]
‘Hasan didn’t read the book.’
oku-ma-yïn
[read-NEG-2PL.IMP]
""Don't read! (2PL)"""
GB140	Is verbal predication marked by the same negator as all of the following types of predication: locational, existential and nominal?	1: present, 0: absent	0	Kornfilt (1997:123-125)			"hasan kitab-ï oku-ma-dï
[Hasan book-ACC read-NEG-PST]
‘Hasan didn’t read the book.’
(ben) hasta deɣil-im
[1SG sick NEG.COP-1SG]
‘I am not sick.’
ben ev-de yok-tu-m
[1SG home-LOC NEG.EXIST-PST-1SG]
‘I was not at home.’"
GB146	Is there a morpho-syntactic distinction between predicates expressing controlled versus uncontrolled events or states?	1: present, 0: absent	0	Kornfilt (1997:50, 217)			"Ahmet-in sinema-ya yalnïz bašïna git-me-si ben-i čok üz-dü
[Ahmet-GEN cinema-DAT alone in go-NMLZ-3sg 1SG-ACC very sadden-PST]
‘That Ahmet went to the movies on himself made me very sad.’"
GB147	Is there a morphological passive marked on the lexical verb?	1: present, 0: absent	1	Kornfilt (1997:323)			
GB148	Is there a morphological antipassive marked on the lexical verb?	1: present, 0: absent	0	Kornfilt (1997:323-336)			
GB149	Is there a morphologically marked inverse on verbs?	1: present, 0: absent	0	Kornfilt (1997:1-553)			
GB150	Is there clause chaining?	1: present, 0: absent	1	Kornfilt (1997:45-46)			
GB151	"Is there an overt verb marker dedicated to signalling coreference or noncoreference between the subject of one clause and an argument of an adjacent clause (""switch reference"")?"	1: present, 0: absent	0	Kornfilt (1997:1-553)			
GB152	Is there a morphologically marked distinction between simultaneous and sequential clauses?	1: present, 0: absent	1	Kornfilt (1997:361)	marked by a clitic meaning ‘while’	marked by a clitic meaning ‘while’	
GB155	Are causatives formed by affixes or clitics on verbs?	1: present, 0: absent	1	Kornfilt (1997:331)			
GB156	Is there a causative construction involving an element that is unmistakably grammaticalized from a verb for 'to say'?	1: present, 0: absent	0	Kornfilt (1997:331)			
GB158	Are verbs reduplicated?	1: present, 0: absent	0	Kornfilt (1997:1-553)			
GB159	Are nouns reduplicated?	1: present, 0: absent	0	Kornfilt (1997:433)	they do not constitute phonological words		"demet demet čiček-ler
[bunch bunch flower-PL]
‘bunches and bunches of flowers’"
GB160	Are elements apart from verbs or nouns reduplicated?	1: present, 0: absent	1	Kornfilt (1997:419)	Adjectives are partially reduplicated.	“Another way of expressing a large measure of a quality is by forming intensive adjectives (and, more rarely, adverbs). This is done by prefixing the first syllable of the stem, and by closing the syllable with a consonant in the prefix, if the syllable is open, and by replacing the syllable-final consonant with another consonant our of a short list of consonants, if that first syllable is close”	"bom-boS
[empty~INTENS]
‘totally empty’"
GB165	Is there productive morphological trial marking on nouns?	1: present, 0: absent	0	Kornfilt (1997:265-266)			
GB166	Is there productive morphological paucal marking on nouns?	1: present, 0: absent	0	Kornfilt (1997:265-266)			
GB167	Is there a logophoric pronoun?	1: present, 0: absent	0	Kornfilt (1997:281)			
GB170	Can an adnominal property word agree with the noun in gender/noun class?	1: present, 0: absent	0	Kornfilt (1997:1-553)			
GB171	Can an adnominal demonstrative agree with the noun in gender/noun class?	1: present, 0: absent	0	Kornfilt (1997:106)			
GB172	Can an article agree with the noun in gender/noun class?	1: present, 0: absent	0	Kornfilt (1997:106, 273)			
GB177	Can the verb carry a marker of animacy of argument, unrelated to any gender/noun class of the argument visible in the NP domain?	1: present, 0: absent	0	Kornfilt (1997:1-553)			
GB184	Can an adnominal property word agree with the noun in number?	1: present, 0: absent	0	Kornfilt (1997:417)		“Attributive adjectives do not agree with nouns”	
GB185	Can an adnominal demonstrative agree with the noun in number?	1: present, 0: absent	0	Kornfilt (1997:106, 268)			"bu kitap-lar
[this book-PL]
‘these books’"
GB186	Can an article agree with the noun in number?	1: present, 0: absent	0	Kornfilt (1997:106, 273)			
GB187	Is there any productive diminutive marking on the noun (exclude marking by system of nominal classification only)?	1: present, 0: absent	1	Kornfilt (1997:445)			
GB188	Is there any productive augmentative marking on the noun (exclude marking by system of nominal classification only)?	1: present, 0: absent	0	Kornfilt (1997:445-447)	Not mentioned.		
GB192	Is there a gender system where a noun's phonological properties are a factor in class assignment?	1: present, 0: absent	0	Kornfilt (1997:270)			
GB193	What is the order of adnominal property word and noun?	"multistate 1: ANM - N; 2: N - ANM; 3: both; 0: they cannot be used attributively"	1	Kornfilt (1997:105, 108-109)			
GB196	Is there a male/female distinction in 2nd person independent pronouns?	1: present, 0: absent	0	Kornfilt (1997:281, 291)			
GB197	Is there a male/female distinction in 1st person independent pronouns?	1: present, 0: absent	0	Kornfilt (1997:281, 291)			
GB198	Can an adnominal numeral agree with the noun in gender/noun class?	1: present, 0: absent	0	Kornfilt (1997:1-553)			
GB203	What is the order of the adnominal collective universal quantifier ('all') and the noun?	0: no UQ, 1: UQ-N, 2: N-UQ, 3: both	1	Kornfilt (1997:57, 324, 346)			
GB204	Do collective ('all') and distributive ('every') universal quantifiers differ in their forms or their syntactic positions?	1: present, 0: absent	1	Kornfilt (1997:432)			"bütün ‘all’
her ‘every, each’"
GB250	Can predicative possession be expressed with a transitive 'habeo' verb?	1: present, 0: absent	0	Kornfilt (1997:185)			
GB252	Can predicative possession be expressed with an S-like possessum and a locative-coded possessor?	1: present, 0: absent	0	Kornfilt (1997:185)		Not mentioned.	
GB253	Can predicative possession be expressed with an S-like possessum and a dative-coded possessor?	1: present, 0: absent	0	Kornfilt (1997:185)			
GB254	Can predicative possession be expressed with an S-like possessum and a possessor that is coded like an adnominal possessor?	1: present, 0: absent	1	Kornfilt (1997:185, 230)			"Hasan-ïn čok eski bir kitabï var
[Hasan-GEN very old a book exist]
‘Hasan has a very old book.’"
GB256	Can predicative possession be expressed with an S-like possessor and a possessum that is coded like a comitative argument?	1: present, 0: absent	0	Kornfilt (1997:185)			
GB257	Can polar interrogation be marked by intonation only?	1: present, 0: absent	0	Kornfilt (1997:5)	the question particle seems to be obligatory		
GB260	Can polar interrogation be indicated by a special word order?	1: present, 0: absent	0	Kornfilt (1997:5)			
GB262	Is there a clause-initial polar interrogative particle?	1: present, 0: absent	0	Kornfilt (1997:5)			
GB263	Is there a clause-final polar interrogative particle?	1: present, 0: absent	1	Kornfilt (1997:5)	it normally attaches to the predicate, but it can also attach to any other constituent if it is under emphasis		
GB264	Is there a polar interrogative particle that most commonly occurs neither clause-initially nor clause-finally?	1: present, 0: absent	0	Kornfilt (1997:5)	it normally attaches to the predicate, but it can also attach to any other constituent if it is under emphasis		"kitab-ï hasan mï Ali-ye ver-di
[book-ACC Hasan Q Ali-DAT give-PST]
‘Did Hasan give the book to Ali?’"
GB265	Is there a comparative construction that includes a form that elsewhere means 'surpass, exceed'?	1: present, 0: absent	0	Kornfilt (1997:178-179)			
GB266	Is there a comparative construction that employs a marker of the standard which elsewhere has a locational meaning?	1: present, 0: absent	1	Kornfilt (1997:178-179)			"sen ben-den iyi bir insan-sin
[2SG 1SG-ABL good a person-2SG]
‘You are a better person than me.’"
GB270	Can comparatives be expressed using two conjoined clauses?	1: present, 0: absent	0	Kornfilt (1997:178-179)			
GB273	Is there a comparative construction with a standard marker that elsewhere has neither a locational meaning nor a 'surpass/exceed' meaning?	1: present, 0: absent	0	Kornfilt (1997:178-179)			
GB275	Is there a bound comparative degree marker on the property word in a comparative construction?	1: present, 0: absent	0	Kornfilt (1997:178-179)			
GB276	Is there a non-bound comparative degree marker modifying the property word in a comparative construction?	1: present, 0: absent	1	Kornfilt (1997:178-179)	"""The adverb daha ‘more’ is often used, but it can be omitted.”"		"sen ben-den daha iyi bir insan-sїn
[2SG 1SG-ABL more good one person-2SG]
‘You are a better person than me.’"
GB285	Can polar interrogation be marked by a question particle and verbal morphology?	1: present, 0: absent	0	Kornfilt (1997:5)			
GB286	Can polar interrogation be indicated by overt verbal morphology only?	1: present, 0: absent	0	Kornfilt (1997:5)	the phonologically bound particle can attach to any part of speech		
GB291	Can polar interrogation be marked by tone?	1: present, 0: absent	0	Kornfilt (1997:5)			
GB296	Is there a phonologically or morphosyntactically definable class of ideophones that includes ideophones depicting imagery beyond sound?	1: present, 0: absent	0	Kornfilt (1997:516-517)			
GB297	Can polar interrogation be indicated by a V-not-V construction?	1: present, 0: absent	0	Kornfilt (1997:5)			
GB298	"Can standard negation be marked by an inflecting word (""auxiliary verb"")?"	1: present, 0: absent	0	Kornfilt (1997:123-125)			
GB299	"Can standard negation be marked by a non-inflecting word (""auxiliary particle"")?"	1: present, 0: absent	0	Kornfilt (1997:123-125)			
GB300	Does the verb for 'give' have suppletive verb forms?	1: present, 0: absent	0	Kornfilt (1997:1-553)			
GB301	Is there an inclusory construction?	1: present, 0: absent	1	Kornfilt (1997:286-287, 298)			
