Grambank ID	Feature	Possible Values	Value	Source	Comment	Detailed comment	Example
GB302	Is there a phonologically free passive marker ('particle' or 'auxiliary')?	1: present, 0: absent	0	Kornfilt (1997:323)			
GB303	Is there a phonologically free antipassive marker ('particle' or 'auxiliary')?	1: present, 0: absent	0	Kornfilt (1997:323-336)			
GB304	Can the agent be expressed overtly in a passive clause?	1: present, 0: absent	1	Kornfilt (1997:323)			
GB305	Is there a phonologically independent reflexive pronoun?	1: present, 0: absent	1	Kornfilt (1997:139, 302)			
GB306	Is there a phonologically independent non-bipartite reciprocal pronoun?	1: present, 0: absent	0	Kornfilt (1997:158)		it is bipartite: bir-bir- [one-one-]	"birbir-imiz e. o. -l.pl.
birbir-iniz e.o. -2.pl.
birbir-Ieri e.o. -3.pl.
""our each other""
""your each other""
""their each other"""
GB309	Are there multiple past or multiple future tenses, distinguishing distance from Time of Reference?	1: present, 0: absent	0	Kornfilt (1997:339, 342)			
GB312	Is there overt morphological marking on the verb dedicated to mood?	1: present, 0: absent	1	Kornfilt (1997:41-42, 366-377)			
GB313	Are there special adnominal possessive pronouns that are not formed by an otherwise regular process?	1: present, 0: absent	0	Kornfilt (1997:306-307)	They are derived from personal pronouns by the genitive suffix.		
GB314	Can augmentative meaning be expressed productively by a shift of gender/noun class?	1: present, 0: absent	0	Kornfilt (1997:270)			
GB315	Can diminutive meaning be expressed productively by a shift of gender/noun class?	1: present, 0: absent	0	Kornfilt (1997:270)			
GB316	Is singular number regularly marked in the noun phrase by a dedicated phonologically free element?	1: present, 0: absent	0	Kornfilt (1997:265-266)			
GB317	Is dual number regularly marked in the noun phrase by a dedicated phonologically free element?	1: present, 0: absent	0	Kornfilt (1997:265-266)			
GB318	Is plural number regularly marked in the noun phrase by a dedicated phonologically free element?	1: present, 0: absent	0	Kornfilt (1997:265-266)			
GB319	Is trial number regularly marked in the noun phrase by a dedicated phonologically free element?	1: present, 0: absent	0	Kornfilt (1997:265-266)			
GB320	Is paucal number regularly marked in the noun phrase by a dedicated phonologically free element?	1: present, 0: absent	0	Kornfilt (1997:265-266)			
GB321	Is there a large class of nouns whose gender/noun class is not phonologically or semantically predictable?	1: present, 0: absent	0	Kornfilt (1997:270)			
GB322	Is there grammatical marking of direct evidence (perceived with the senses)?	1: present, 0: absent	0	Kornfilt (1997:1-553)			
GB323	Is there grammatical marking of indirect evidence (hearsay, inference, etc.)?	1: present, 0: absent	0	Kornfilt (1997:1-553)			
GB324	Is there an interrogative verb for content interrogatives (who?, what?, etc.)?	1: present, 0: absent	0	Kornfilt (1997:5)			
GB325	Is there a count/mass distinction in interrogative quantifiers?	1: present, 0: absent	1	Kornfilt (1997:318, 320)			"ne kadar ‘how much’
cač ‘how many’"
GB326	Do (nominal) content interrogatives normally or frequently occur in situ?	1: present, 0: absent	1	Kornfilt (1997:9-32, 91)			
GB327	Can the relative clause follow the noun?	1: present, 0: absent	0	Kornfilt (1997:61)	Only in a borrowed pattern		
GB328	Can the relative clause precede the noun?	1: present, 0: absent	1	Kornfilt (1997:57-66, 105)			
GB329	Are there internally-headed relative clauses?	1: present, 0: absent	0	Kornfilt (1997:57-66)			
GB330	Are there correlative relative clauses?	1: present, 0: absent	0	Kornfilt (1997:57-66)			
GB331	Are there adjoined relative clauses?	1: present, 0: absent	0	Kornfilt (1997:57-66)			
GB333	Is there a decimal numeral system?	1: present, 0: absent	1	Kornfilt (1997:428)			
GB334	Is there synchronic evidence for any element of a quinary numeral system?	1: present, 0: absent	0	Kornfilt (1997:428)			
GB335	Is there synchronic evidence for any element of a vigesimal numeral system?	1: present, 0: absent	0	Kornfilt (1997:428)			
GB336	Is there a body-part tallying system?	1: present, 0: absent	0	Kornfilt (1997:1-553)			
GB400	Are all person categories neutralized in some voice, tense, aspect, mood and/or negation?	1: present, 0: absent	0	Kornfilt (1997:385, 390-391)	There is no agreement on the verb if the subject is non-referential.		
GB401	Is there a class of patient-labile verbs?	1: present, 0: absent	0	Kornfilt (1997:328)	A middle voice suffix is obligatory.		
GB402	Does the verb for 'see' have suppletive verb forms?	1: present, 0: absent	0	Kornfilt (1997:1-553)			
GB403	Does the verb for 'come' have suppletive verb forms?	1: present, 0: absent	0	Kornfilt (1997:1-553)			
GB408	Is there any accusative alignment of flagging?	1: present, 0: absent	1	Kornfilt (1997:219-220)			"ben kitab-ï oku-du-m
[1SG book-ACC read-PST-1SG]
'I read the book.’"
GB409	Is there any ergative alignment of flagging?	1: present, 0: absent	0	Kornfilt (1997:217-220)			
GB410	Is there any neutral alignment of flagging?	1: present, 0: absent	1	Kornfilt (1997:219-220)	unspecific P is unmarked		"ben bir kitab oku-du-m
[1SG a book read-PST-1SG]
'I read a book.’"
GB415	Is there a politeness distinction in 2nd person forms?	1: present, 0: absent	0	Kornfilt (1997:281)			
GB421	Is there a preposed complementizer in complements of verbs of thinking and/or knowing?	1: present, 0: absent	1	Kornfilt (1997:46)		ki	
GB422	Is there a postposed complementizer in complements of verbs of thinking and/or knowing?	1: present, 0: absent	0	Kornfilt (1997:46)			
GB430	Can adnominal possession be marked by a prefix on the possessor?	1: present, 0: absent	0	Kornfilt (1997:185)			
GB431	Can adnominal possession be marked by a prefix on the possessed noun?	1: present, 0: absent	0	Kornfilt (1997:185)			
GB432	Can adnominal possession be marked by a suffix on the possessor?	1: present, 0: absent	1	Kornfilt (1997:185)	genitive case marker		"hasan-ïn kitab-ïn
[Hasan-GEN book-3SG]
‘Hasan’s book’"
GB433	Can adnominal possession be marked by a suffix on the possessed noun?	1: present, 0: absent	1	Kornfilt (1997:185)			"hasan-ïn kitab-ïn
[Hasan-GEN book-3SG]
‘Hasan’s book’"
GB519	"Can mood be marked by a non-inflecting word (""auxiliary particle"")?"	1: present, 0: absent	0	Kornfilt (1997:1-553)			
GB520	"Can aspect be marked by a non-inflecting word (""auxiliary particle"")?"	1: present, 0: absent	0	Kornfilt (1997:349-363)			
GB521	"Can tense be marked by a non-inflecting word (""auxiliary particle"")?"	1: present, 0: absent	0	Kornfilt (1997:1-553)			
GB522	"Can the S or A argument be omitted from a pragmatically unmarked clause when the referent is inferrable from context (""pro-drop"" or ""null anaphora"")?"	1: present, 0: absent	1	Kornfilt (1997:129, 281-283)			"(ben) ev-de yok-tu-m
[(1SG) home-LOC NEG.EXIST-PST-1SG]
‘I was not at home.’"
TE001	Is root structure predominantly polysyllabic?	1: present, 0: absent	1	Kornfilt (1997:1-553)			
TE002	Are complex tonal distinctions lacking?	1: present, 0: absent	1	Kornfilt (1997:505)			
TE003	Is there palatal vowel harmony?	1: present, 0: absent	1	Kornfilt (1997:498-500)			
TE004	Is there tongue root vowel harmony?	1: present, 0: absent	0	Kornfilt (1997:498-500)			
TE005	Is there an initial velar nasal?	1: present, 0: absent	0	Kornfilt (1997:486)			
TE006	Is there an initial r-?	1: present, 0: absent	0	Kornfilt (1997:492)			
TE007	Are there initial consonant clusters in native words?	1: present, 0: absent	0	Kornfilt (1997:492, 498)			
TE008	Is there a voicing distinction in stops?	1: present, 0: absent	1	Kornfilt (1997:484)			
TE009	Are borrowed verbs accommodated through a light-verb or a verbalizer?	1: present, 0: absent	1	Kornfilt (1997:1-553)		Not mentioned.	
TE012	Are property words verbally or nominally encoded?	1: present, 0: absent	0	Kornfilt (1997:83, 414)			
TE014	Is there partial emphatic reduplication of nominal property words?	1: present, 0: absent	1	Kornfilt (1997:419)			
TE015	Are morphemes connected linearly in a way that there is a one on one relationship between a morpheme and its meaning?	1: present, 0: absent	1	Kornfilt (1997:212)			"oku-du-m
[read-PST-1SG]
kitab-ïn
[book-3SG]"
TE016	Is inflectional morphology predominantly suffixing?	1: present, 0: absent	1	Kornfilt (1997:212)			
TE018	Is there a mi-ti opposition in 1 vs. 2 SG personal pronouns?	1: present, 0: absent	1	Kornfilt (1997:281)			ben sen
TE019	Is the secondary oblique stem of personal pronouns formed with a dental nasal?	1: present, 0: absent	1	Kornfilt (1997:281)			"o [3SG.NOM]
on-a [3SG-DAT]"
TE022	Are gerunds or adverbial participles used to mark adverbial subordination?	1: present, 0: absent	1	Kornfilt (1997:67-76)			"müdür tatil-e čik-tiɣ-ïn-dan ofis kapalï
[director vacation-DAT go-NMLZ-3SG office closed]
‘Because the director went on vacation, the office is closed.’"
TE025	Are specific non-finite and finite suffixes expressed by a formally identical suffix?	1: present, 0: absent	1				
TE026	Are specific negative verbs and negative suffixes/particles expressed by a formally identical suffix?	1: present, 0: absent	0	Kornfilt (1997:123-125)			
TE027	Can 1PL marker be augmented by a collective plural marker?	1: present, 0: absent	1	Kornfilt (1997:281, 287)			biz-ler [1PL-PL] ‘we’
TE028	Do core adjectives (defined semantically as property concepts such as value, shape, age, dimension) act like nouns in predicative position?	1: present, 0: absent	0	Kornfilt (1997:83)			
TE029	"Do core adjectives (defined semantically as property concepts; value, shape, age, dimension) used attributively require the same morphological treatment as nouns?"	1: present, 0: absent	0	Kornfilt (1997:414)			
TE031	Is there a non-initial velar nasal?	1: present, 0: absent	0	Kornfilt (1997:486)		not distinctive	
TE033	Is there a reciprocal marker that is distinct from the reflexive marker?	1: present, 0: absent	1	Kornfilt (1997:139, 158)		"reflexive: kendi-m [self-1SG], kendi-n [self-2SG] etc. 
reciprocal: birbir-imiz [each.other-1PL], birbir-iniz [each.other-2PL] etc."	"kendi-m [self-1SG]
birbir-imiz [each.other-1PL]"
TE034	Are there deranked purpose clauses?	1: present, 0: absent	1	Kornfilt (1997:73)			"hasan kitab-ï san-a ver-mek ičin al-dï
[Hasan book-ACC you-DAT give-INF for buy-PST]
‘Hasan bought the book in order to give it to you.’"
TE036	Can the notional subject of a want complement clause be left implicit when it is coreferential with the wanter?	1: present, 0: absent	1	Kornfilt (1997:46)		The notional subject is marked on the verb, but not expressed through a free-standing pronoun.	"isti-yor-um ki yarïn ben-im-le sinema-ya gel-esin
[want-PRS.PROG-1SG COMPL tomorrow 1SG-GEN-with cinema-DAT come-2SG.OPT]
‘I want you to come to the movies with me tomorrow.’"
TE037	Is there a voicing distinction in fricatives?	1: present, 0: absent	1	Kornfilt (1997:485)			
TE038	Are there two separate liquid phonemes (r/l)?	1: present, 0: absent	1	Kornfilt (1997:486-487)			
TE039	Is there vowel length distinction?	1: present, 0: absent	0	Kornfilt (1997:501-502)			
TE040	Are causative posture verbs derived and static-dynamic verbs basic?	1: present, 0: absent	0	Kornfilt (1997:331-333)			"dur ‘stand’, koy ‘put’
otur ‘sit’, kur ‘set up’"
TE041	Is there a male/female distinction in the sibling terms from the perspective of the speaker?	1: present, 0: absent	1	Kornfilt (1997:519)			"dayï ‘maternal uncle’
amǰa ‘paternal uncle’
teyze ‘maternal aunt’
hala ‘paternal aunt’"
TE042	Is there an age distinction in sibling terms?	1: present, 0: absent	1	Kornfilt (1997:519)			"erkek kardeš ‘brother’
aɣabey ‘elder brother’
kïzkardeš ‘sister’
abla ‘elder sister’"
TE043	Are nouns most commonly derived from verbs than the other way around?	1: present, 0: absent	1	Kornfilt (1997:447-450, 453-454)			
TE044	Are ‘hand’ and ‘arm’ expressed by the same term?	1: present, 0: absent	0	Kornfilt (1997:524-525)			"kol ‘arm’
el ‘hand’"
TE045	Are ‘moon’ and ‘month’ expressed by the same term?	1: present, 0: absent	1	Kornfilt (1997:534)			"ay ‘moon’
ay ‘month’"
TE046	Is there a plural/collective suffix that is restricted to animates?	1: present, 0: absent	0	Kornfilt (1997:265-266)			
TE047	Can scalar additive operators (‘even’) also be used in non-scalar contexts (also)?	1: present, 0: absent	0	Kornfilt (1997:192, 195, 199, 423, 444)		bile ‘even’, de ‘also’	"hasan bile kitab-ï ali-ye okudu
[Hasan even book-ACC Ali-DAT read-PST]
‘Even Hasan read the book to Ali.’
hasan bügün de erken kalk-tï
[Hasan today too early rise-PST]
‘Today Hasan got up early too.’"
TE048	Is there a reflexive-possessive affix?	1: present, 0: absent	0	Kornfilt (1997:1-553)		Not mentioned.	
TE049	Are demonstratives verbally encoded?	1: present, 0: absent	0	Kornfilt (1997:311-315)			
TE050	Do cardinal numerals require agreement on noun phrases?	1: present, 0: absent	0	Kornfilt (1997:265, 429)			"beš öɣrenǰi
[five student]
‘five students'"
TE051	Is nominative case unmarked?	1: present, 0: absent	1	Kornfilt (1997:217)			
TE052	Are accusative-marked objects specific while unmarked objects are non-specific?	1: present, 0: absent	1	Kornfilt (1997:219)			
TE053	Are recipient and location expressed by the same marker?	1: present, 0: absent	0	Kornfilt (1997:217-227, 235)		"DAT: -ye, -a
ABL: -den, -dan, -tan etc."	"hasan kitab-ï ali-ye ver-di
[Hasan book-ACC Ali-DAT give-PST]
‘Hasan gave the book to Ali.’
kitap masa-da
[book table-LOC]
‘The book is on the table.’"
TE054	Is there a distinction between marking of interrogation in polar and content questions?	1: present, 0: absent	1	Kornfilt (1997:9-32)		There are no particles for content interrogation.	"bu kitab-ï kim oku-da
[this book-ACC who read-PST]
‘Who read this book?’
kitab-ï hasan mï Ali-ye ver-di
[book-ACC Hasan Q Ali-DAT give-PST]
‘Did Hasan give the book to Ali?’"
TE055	Is acting agent in passive clause expressed by a dative-marked noun phrase?	1: present, 0: absent	0	Kornfilt (1997:323)			"Amerika Kristof Kolomb taraf-ïn-dan kešf-ed-il-di
[America Christopher Columbus side-3SG-ABL discovery-do-PASS-PST]
‘America was discovered by Christopher Columbus.’"
TE056	Is the subject of an adnominalized clause marked by the genitive case?	1: present, 0: absent	1	Kornfilt (1997:50, 67)			"Ahmed-in sinema-ya yalnïz bašïna git-me-si ben-i čok üz-dü
[Ahmet-GEN cinema-DAT alone in go-NMLZ-3sg 1SG-ACC very sadden-PST]
‘That Ahmet went to the movies on himself made me very sad.’
(ben) Ahmed-in öl-düɣ-ün-ü duy-du-m
[(1SG) Ahmet-GEN die-NMLZ-3sg-ACC hear-PST-1sg]
‘I heard that Ahmet died.’"
TE057	Can a passive construction have adversative meaning?	1: present, 0: absent	0	Kornfilt (1997:323)		Not mentioned.	
TE058	Can demonstrative/interrogative verbs be derived from pronouns and light verbs ‘to do’?	1: present, 0: absent	0	Kornfilt (1997:311-315)			
TE059	Are causative and passive expressed by a formally identical marker?	1: present, 0: absent	0	Kornfilt (1997:323, 331)		"causative: -tur, -tïr, -ït, -t and allomorphs
passive: -il, -l, -n and allomorphs"	
TE060	Are converb suffixes and deverbal noun suffixes formally identical?	1: present, 0: absent	?	Kornfilt (1997:1-553)		Not mentioned.	
TE061	Are quotative markers adverbial derivations from a verb ‘to say’?	1: present, 0: absent	1	Kornfilt (1997:1-2)			"sen biz-e (biz) yarïn seyahat-e čïk-acaɣ-iz diye söz ver-di-n
[2SG 1PL-DAT (1PL) tomorrow trip-DAT go-FUT-1PL saying promise give-PST-2SG]
‘You promised us: we are going on a trip tomorrow.’"
TE062	Can relational adpositions (e.g. ‘under’) be derived from a place noun (e.g. ‘bottom’) and a locational suffix (e.g. at LOC)?	1: present, 0: absent	1	Kornfilt (1997:101, 470-471)		only with nouns borrowed from Arabic	"taraf-ïmïz-dan
[side-1PL-ABL]
‘by us’"
TE063	Are hortatives/purposives encoded by the same marker (eventually involving a converb of the verb ‘to say’)?	1: present, 0: absent	0	Kornfilt (1997:369-378)			
TE064	Are denominal verbalizers and deverbal suffixes sharing comparable actional semantics expressed by the same marker?	1: present, 0: absent	?	Kornfilt (1997:1-553)		Not mentioned.	
TE065	Is ‘it is becoming if’ grammaticalized in deontic modality?	1: present, 0: absent	0	Kornfilt (1997:369-378)			
TE066	Is imperative form for 2SG identical to bare verb root?	1: present, 0: absent	1	Kornfilt (1997:40-41, 383)			"git-mek [go-INF] ‘to go’
git [go] ‘Go (2SG)!’"
TE067	Is person marking on the verb formally identical to independent personal pronouns?	1: present, 0: absent	0	Kornfilt (1997:281, 382)		similar, but not identical	
TE068	Is there a comparative construction that employs a marker of the standard which elsewhere has a meaning ‘to see’?	1: present, 0: absent	0	Kornfilt (1997:178-179)			
TE069	Can a copula be derived from original posture verbs?	1: present, 0: absent	0	Kornfilt (1997:78-82)			
TE070	Can the notional subject of a want complement clause be expressed overtly when it is coreferential with the wanter?	1: present, 0: absent	0	Kornfilt (1997:388, 407-408, 549)			
TE071	Are ‘foot’ and ‘leg’ expressed by the same term?	1: present, 0: absent	0	Kornfilt (1997:524-525)			"baǰak ‘leg’
et ‘foot’"
TE072	Are there balanced purpose clauses?	1: present, 0: absent	?				
TE073	Is there an adposition or a particle formally similar to the verb?	1: present, 0: absent	?	Kornfilt (1997:100-101)			
TE074	Is completive aspect expressed by a marker formally identical to the verb ’to put/throw away’?	1: present, 0: absent	0	Kornfilt (1997:349-350)			"-miš
at ‘throw’"
TE076	Are there adpositions to mark core NPs?	1: present, 0: absent	0	Kornfilt (1997:100-101, 219-220)			
TE077	Are there adpositions to mark oblique NPs?	1: present, 0: absent	1	Kornfilt (1997:100-101)			"hasan ban-a inat iš-e git-ti
[Hasan 1SG-DAT spite work-DAT go-PST]
‘Hasan went to work despite my wishes to the contrary.'"
TE078	Are there three laryngeal contrasts for stops?	1: present, 0: absent	0	Kornfilt (1997:484)			
TS001	Can numeral precede the noun?	1: present, 0: absent	1	Kornfilt (1997:106, 429)			
TS002	Can numeral follow the noun?	1: present, 0: absent	0	Kornfilt (1997:106, 429)			
TS003	Can demonstrative precede the noun?	1: present, 0: absent	1	Kornfilt (1997:311-315)			
TS004	Can demonstrative follow the noun?	1: present, 0: absent	0	Kornfilt (1997:311-315)			
TS005	Can adnominal possessor precede the possessed noun?	1: present, 0: absent	1	Kornfilt (1997:185)			"hasan-ïn kitab-ïn
Hasan-GEN book-3SG
‘Hasan’s book’"
TS006	Can adnominal possessor follow the possessed noun?	1: present, 0: absent	1	Kornfilt (1997:185)			"hasan-ïn kitab-ïn
[Hasan-GEN book-3SG]
‘Hasan’s book’"
TS007	Can adnominal property word precede the noun?	1: present, 0: absent	1	Kornfilt (1997:105, 108-109)			
TS008	Can adnominal property word follow the noun?	1: present, 0: absent	0	Kornfilt (1997:105, 108-109)			
TS009	Can adnominal collective universal quantifier (‘all’) precede the noun?	1: present, 0: absent	1	Kornfilt (1997:57, 324, 346)			
TS010	Can adnominal collective universal quantifier (‘all’) follow the noun?	1: present, 0: absent	0	Kornfilt (1997:57, 324, 346)			
TS079	Is there height vowel harmony?	1: present, 0: absent	0	Kornfilt (1997:498-500)			
TS080	Is there labial vowel harmony?	1: present, 0: absent	1	Kornfilt (1997:498-500)			"göl-ü [lake-ACC]
čoǰuɣ-u [child-ACC]"
TS081	Is there an initial l-?	1: present, 0: absent	?	Kornfilt (1997:1-553)			
TS082	Do numerals have the same form in attributive and predicative use?	1: present, 0: absent	?	Kornfilt (1997:1-553)			
TS083	Is the meaning ‘to hunt’ expressed as noun+denominalizer?	1: present, 0: absent	?	Kornfilt (1997:1-553)			
TS083	Are instrumental and comitative expressed by the same marker?	1: present, 0: absent	?	Kornfilt (1997:1-553)			
TS084	Are the meanings ‘to see’ and ‘to try’ expressed by formally identical verbs?	1: present, 0: absent	?	Kornfilt (1997:1-553)			
TS085	What is the order of personal possessive suffixes and case suffixes?	"0: one category missing; 1: POSS-case; 2: case-POSS; 3: both"	?	Kornfilt (1997:1-553)			
TS086	Is the pragmatically unmarked order of SV in intransitive clauses?	1: present, 0: absent	1	Kornfilt (1997:46, 82)			
TS087	Is the pragmatically unmarked order of VS in intransitive clauses?	1: present, 0: absent	0	Kornfilt (1997:46, 82)			
TS088	Is there an aspiration distinction in stops?	1: present, 0: absent	0	Kornfilt (1997:484)			